{"dataset_id":"sha256:611d83367d6b86a210ebdb30a2e73aa30dc35f8efd59f07fb43febf60c98defd","manifest_core":{"canonicalization_version":"RFC8785","condition_event_count":3,"condition_event_schema_version":"1.0.0","connector_version":"fixture-v1","event_time_from_utc":"2026-01-01T00:00:00.000Z","event_time_to_utc":"2026-01-01T00:00:06.000Z","incident_count":8,"incident_schema_version":"1.0.0","logical_artifacts":[{"artifact_id":"source_events:000000","logical_content_sha256":"54f6040c6443d25182d88198b175a6b864f37fa4fb48dd8efe3ae06ea31b968a","record_count":6,"role":"source_events","segment_index":0},{"artifact_id":"source_events:000001","logical_content_sha256":"188ddb63101f15c391265e32b2e91027c6b5a1c06abe6d34c1e9fe05de5019e6","record_count":5,"role":"source_events","segment_index":1},{"artifact_id":"normalized_ticks:000000","logical_content_sha256":"07378d8675958540756da62a3cdd53979dc8870f6bf1d009a96d8f4d3b2d01f4","record_count":7,"role":"normalized_ticks","segment_index":0},{"artifact_id":"quality_incidents:000000","logical_content_sha256":"47d2a3d72e03b32c1ecccd49c37d3096ba0de605c505db0f80628815096209bf","record_count":8,"role":"quality_incidents","segment_index":0},{"artifact_id":"operational_conditions:000000","logical_content_sha256":"9958131b607b123a4dafcdc2fdce4fc770158073558a053430b2dc15e3c7215b","record_count":3,"role":"operational_conditions","segment_index":0}],"market_tick_schema_version":"1.0.0","normalized_tick_count":7,"normalizer_version":"1.0.0","quality_profile_id":"synthetic-v1","quality_profile_sha256":"403d468124608715938f4bab6100ac412712dbd54d3c8d1814672ac1b7db3d4f","quality_rule_version":"1.0.0","raw_frame_count":8,"schema_version":"1.0.0","segment_policy_version":"1.0.0","source":"synthetic","source_event_count":11,"source_event_schema_version":"1.0.0","source_schema_release":"synthetic-v1","source_schema_sha256":"9f65cc1cf89e4e28e0351dd16c013f6354480fcc6046c8b090588e7ba2982925","symbols":["SYNTH_100"]},"publication_id":"019b76da-cb28-7003-8000-000000000001","published_at_utc":"2026-01-01T00:00:09.000Z","schema_version":"1.0.0","state":"published","storage_objects":[{"artifact_id":"normalized_ticks:000000","compression":"none","logical_content_sha256":"07378d8675958540756da62a3cdd53979dc8870f6bf1d009a96d8f4d3b2d01f4","media_type":"application/x-ndjson","object_bytes_sha256":"07378d8675958540756da62a3cdd53979dc8870f6bf1d009a96d8f4d3b2d01f4","role":"normalized_ticks","size_bytes":3640,"uri":"fixture://expected-ticks.ndjson"},{"artifact_id":"operational_conditions:000000","compression":"none","logical_content_sha256":"9958131b607b123a4dafcdc2fdce4fc770158073558a053430b2dc15e3c7215b","media_type":"application/x-ndjson","object_bytes_sha256":"9958131b607b123a4dafcdc2fdce4fc770158073558a053430b2dc15e3c7215b","role":"operational_conditions","size_bytes":1455,"uri":"fixture://expected-conditions.ndjson"},{"artifact_id":"quality_incidents:000000","compression":"none","logical_content_sha256":"47d2a3d72e03b32c1ecccd49c37d3096ba0de605c505db0f80628815096209bf","media_type":"application/x-ndjson","object_bytes_sha256":"47d2a3d72e03b32c1ecccd49c37d3096ba0de605c505db0f80628815096209bf","role":"quality_incidents","size_bytes":4021,"uri":"fixture://expected-incidents.ndjson"},{"artifact_id":"quality_profile:000000","compression":"none","logical_content_sha256":"403d468124608715938f4bab6100ac412712dbd54d3c8d1814672ac1b7db3d4f","media_type":"application/json","object_bytes_sha256":"8273ba9ecb2317425147b43bbbff24ca7fc673ef241a8c796e6cf5be36a76626","role":"quality_profile","size_bytes":249,"uri":"fixture://quality-profile.json"},{"artifact_id":"source_events:000000","compression":"none","logical_content_sha256":"54f6040c6443d25182d88198b175a6b864f37fa4fb48dd8efe3ae06ea31b968a","media_type":"application/x-ndjson","object_bytes_sha256":"54f6040c6443d25182d88198b175a6b864f37fa4fb48dd8efe3ae06ea31b968a","role":"source_events","size_bytes":2881,"uri":"fixture://expected-source-events-000000.ndjson"},{"artifact_id":"source_events:000001","compression":"none","logical_content_sha256":"188ddb63101f15c391265e32b2e91027c6b5a1c06abe6d34c1e9fe05de5019e6","media_type":"application/x-ndjson","object_bytes_sha256":"188ddb63101f15c391265e32b2e91027c6b5a1c06abe6d34c1e9fe05de5019e6","role":"source_events","size_bytes":1993,"uri":"fixture://expected-source-events-000001.ndjson"},{"artifact_id":"source_schema:000000","compression":"none","logical_content_sha256":"9f65cc1cf89e4e28e0351dd16c013f6354480fcc6046c8b090588e7ba2982925","media_type":"application/schema+json","object_bytes_sha256":"533a48ff53012c6bd519028209dec22a9658d7ebd54848b8e4ed5f9e69676e74","role":"source_schema","size_bytes":847,"uri":"fixture://source-schema.json"}]}