{"dataset_id":"sha256:7768d9551e4f5a2a0c16adaf1e93f98461b5cf894dac0c0c8fa7b1c1fe8d431f","manifest_core":{"canonicalization_version":"RFC8785","condition_event_count":0,"condition_event_schema_version":"1.0.0","connector_version":"fixture-v1","event_time_from_utc":null,"event_time_to_utc":null,"incident_count":1,"incident_schema_version":"1.0.0","logical_artifacts":[{"artifact_id":"source_events:000000","logical_content_sha256":"f1829712d346b0aa64924fb9b42c02acaef00cb741eecb39543e9fe8eaa9d127","record_count":1,"role":"source_events","segment_index":0},{"artifact_id":"normalized_ticks:000000","logical_content_sha256":"e3b0c44298fc1c149afbf4c8996fb92427ae41e4649b934ca495991b7852b855","record_count":0,"role":"normalized_ticks","segment_index":0},{"artifact_id":"quality_incidents:000000","logical_content_sha256":"32ae650b94f662f1b313eba8002b813849939899b33505be05e8a7bb3e45d353","record_count":1,"role":"quality_incidents","segment_index":0},{"artifact_id":"operational_conditions:000000","logical_content_sha256":"e3b0c44298fc1c149afbf4c8996fb92427ae41e4649b934ca495991b7852b855","record_count":0,"role":"operational_conditions","segment_index":0}],"market_tick_schema_version":"1.0.0","normalized_tick_count":0,"normalizer_version":"1.0.0","quality_profile_id":"synthetic-v1","quality_profile_sha256":"403d468124608715938f4bab6100ac412712dbd54d3c8d1814672ac1b7db3d4f","quality_rule_version":"1.0.0","raw_frame_count":1,"schema_version":"1.0.0","segment_policy_version":"1.0.0","source":"synthetic","source_event_count":1,"source_event_schema_version":"1.0.0","source_schema_release":"synthetic-v1","source_schema_sha256":"9f65cc1cf89e4e28e0351dd16c013f6354480fcc6046c8b090588e7ba2982925","symbols":["SYNTH_100"]},"publication_id":"019b76da-abe8-7103-8000-000000000001","published_at_utc":"2026-01-01T00:00:01.000Z","schema_version":"1.0.0","state":"published","storage_objects":[{"artifact_id":"normalized_ticks:000000","compression":"none","logical_content_sha256":"e3b0c44298fc1c149afbf4c8996fb92427ae41e4649b934ca495991b7852b855","media_type":"application/x-ndjson","object_bytes_sha256":"e3b0c44298fc1c149afbf4c8996fb92427ae41e4649b934ca495991b7852b855","role":"normalized_ticks","size_bytes":0,"uri":"fixture://zero-valid-ticks/expected-ticks.ndjson"},{"artifact_id":"operational_conditions:000000","compression":"none","logical_content_sha256":"e3b0c44298fc1c149afbf4c8996fb92427ae41e4649b934ca495991b7852b855","media_type":"application/x-ndjson","object_bytes_sha256":"e3b0c44298fc1c149afbf4c8996fb92427ae41e4649b934ca495991b7852b855","role":"operational_conditions","size_bytes":0,"uri":"fixture://zero-valid-ticks/expected-conditions.ndjson"},{"artifact_id":"quality_incidents:000000","compression":"none","logical_content_sha256":"32ae650b94f662f1b313eba8002b813849939899b33505be05e8a7bb3e45d353","media_type":"application/x-ndjson","object_bytes_sha256":"32ae650b94f662f1b313eba8002b813849939899b33505be05e8a7bb3e45d353","role":"quality_incidents","size_bytes":500,"uri":"fixture://zero-valid-ticks/expected-incidents.ndjson"},{"artifact_id":"quality_profile:000000","compression":"none","logical_content_sha256":"403d468124608715938f4bab6100ac412712dbd54d3c8d1814672ac1b7db3d4f","media_type":"application/json","object_bytes_sha256":"8273ba9ecb2317425147b43bbbff24ca7fc673ef241a8c796e6cf5be36a76626","role":"quality_profile","size_bytes":249,"uri":"fixture://quality-profile.json"},{"artifact_id":"source_events:000000","compression":"none","logical_content_sha256":"f1829712d346b0aa64924fb9b42c02acaef00cb741eecb39543e9fe8eaa9d127","media_type":"application/x-ndjson","object_bytes_sha256":"f1829712d346b0aa64924fb9b42c02acaef00cb741eecb39543e9fe8eaa9d127","role":"source_events","size_bytes":471,"uri":"fixture://zero-valid-ticks/expected-source-events.ndjson"},{"artifact_id":"source_schema:000000","compression":"none","logical_content_sha256":"9f65cc1cf89e4e28e0351dd16c013f6354480fcc6046c8b090588e7ba2982925","media_type":"application/schema+json","object_bytes_sha256":"533a48ff53012c6bd519028209dec22a9658d7ebd54848b8e4ed5f9e69676e74","role":"source_schema","size_bytes":847,"uri":"fixture://source-schema.json"}]}